<?xml version="1.0"?>
<!DOCTYPE Report
[
<!ELEMENT Report (General ,(Doc|BPT)) >
<!ATTLIST Report ver CDATA #REQUIRED tmZone CDATA #REQUIRED>

<!ELEMENT General ( DocLocation ) >
<!ATTLIST General productName CDATA #REQUIRED productVer CDATA #REQUIRED os CDATA #REQUIRED host CDATA #REQUIRED qcserver CDATA #IMPLIED qcproject CDATA #IMPLIED  >

<!ELEMENT BPT (DName,Res,DVer?,TSet?,TInst?,NodeArgs,AdditionalInfo*,Doc*) >
<!ATTLIST BPT rID ID #REQUIRED >

<!ELEMENT Doc (DName,ConfName?,Res,DVer?,TSet?,TInst?,RunType?,DT?,AdditionalInfo*,Step*,DIter*,Step*,Action*,Doc*,Summary?,TestMaintenanceSummary*,NodeArgs?) >
<!ATTLIST Doc rID ID #REQUIRED type (Test|BC|BPTWrapperTest|Flow|Group) "Test" productName CDATA #REQUIRED BCIter CDATA #IMPLIED >

<!ELEMENT RunType ( #PCDATA )>
<!ATTLIST RunType fmStep (False|True) "False" batch (False|True) "False" upDesc (False|True) "False" upChk (False|True) "False" upAS (False|True) "False">

<!ELEMENT DName ( #PCDATA ) >

<!ELEMENT ConfName ( #PCDATA ) >

<!ELEMENT Res ( #PCDATA ) >

<!ELEMENT AdditionalInfo (AdditionalDataName,AdditionalDataValue ) >

<!ELEMENT AdditionalDataName ( #PCDATA ) >

<!ELEMENT AdditionalDataValue ( #PCDATA ) >

<!ELEMENT DVer ( #PCDATA ) >

<!ELEMENT TSet ( #PCDATA ) >

<!ELEMENT TInst ( #PCDATA ) >

<!ELEMENT DIter (Step*,Action+,Summary?,NodeArgs)>
<!ATTLIST DIter rID ID #REQUIRED iterID CDATA #REQUIRED>

<!ELEMENT DocLocation ( #PCDATA )>

<!ELEMENT Action (AName,AIter*,(Step|HtmlStep|Action)*,Summary,ActionMaintenanceSummary*,NodeArgs ) >
<!ATTLIST Action rID ID #REQUIRED>

<!ELEMENT AIter ((Step|HtmlStep|Action)*,Summary?,NodeArgs) >
<!ATTLIST AIter rID ID #REQUIRED iterID CDATA #REQUIRED>

<!ELEMENT AName ( #PCDATA ) >

<!ELEMENT TestMaintenanceSummary (ActionMaintenanceSummary*) >
<!ATTLIST TestMaintenanceSummary ObjectsAdded CDATA #REQUIRED ObjectsUpdated CDATA #REQUIRED StepsUpdated CDATA #REQUIRED StepsComments CDATA #REQUIRED><!ELEMENT ActionMaintenanceSummary (ObjectChange* ) >
<!ATTLIST ActionMaintenanceSummary Action CDATA #REQUIRED Objects CDATA #REQUIRED Updated CDATA #REQUIRED LinesTotal CDATA #REQUIRED Added CDATA #REQUIRED LinesUpdated CDATA #REQUIRED>

<!ELEMENT ObjectChange  (Hierarchy, PropertyChangeList* ) >
<!ATTLIST ObjectChange Operation CDATA #IMPLIED OriginalRepository CDATA #IMPLIED>

<!ELEMENT PropertyChangeList (PropertyDef*) >

<!ELEMENT PropertyDef (OriginalValue, NewValue) >
<!ATTLIST PropertyDef PropName CDATA #REQUIRED OriginRegularExpression (True|False) "False" NewRegularExpression (True|False) "False" AddedProperty (True|False) "False" >

<!ELEMENT OriginalValue ( #PCDATA )>

<!ELEMENT NewValue ( #PCDATA )>

<!ELEMENT Hierarchy  (ObjectName, Hierarchy*) >
<!ATTLIST Hierarchy MicClass CDATA #REQUIRED>

<!ELEMENT ObjectName  ( #PCDATA ) >

<!ELEMENT Step (Obj,Details,Time,TimeTick* ,(Step|HtmlStep|Doc)*,NodeArgs) >
<!ATTLIST Step rID ID #REQUIRED retval CDATA #IMPLIED>

<!ELEMENT HtmlStep (HTML,TimeTick*,(Step|HtmlStep|Doc)*,NodeArgs) >
<!ATTLIST HtmlStep rID ID #REQUIRED >

<!ELEMENT Obj ( #PCDATA ) >
<!ATTLIST Obj plainTxt (False|True) "True">

<!ELEMENT Details ( #PCDATA ) >
<!ATTLIST Details plainTxt (False|True) "True">

<!ELEMENT Time ( #PCDATA ) >

<!ELEMENT HTML ( #PCDATA ) >

<!ELEMENT Disp ( #PCDATA ) >

<!ELEMENT TimeTick ( #PCDATA ) >

<!ELEMENT NodeArgs (Disp,TopPane?,BtmPane?,ExtendedInfo? )>
<!ATTLIST NodeArgs eType CDATA #REQUIRED icon CDATA #REQUIRED nRep CDATA #REQUIRED UserNote CDATA #IMPLIED filter (False|True) "True">
<!ATTLIST NodeArgs status (Passed|Failed|Done|Warning|Information) "Done">
<!ATTLIST NodeArgs iconSel CDATA #IMPLIED nType CDATA #IMPLIED MovieMarker CDATA "">
<!ATTLIST NodeArgs Source CDATA #IMPLIED SourceLine CDATA #IMPLIED >

<!ELEMENT TopPane (Path)>

<!ELEMENT BtmPane ( (Path|WR)?,ASHilite?)>
<!ATTLIST BtmPane vType CDATA "HTML">

<!ELEMENT Path ( #PCDATA ) >

<!ELEMENT ASHilite ( #PCDATA ) >

<!ELEMENT WR ( #PCDATA ) >

<!ELEMENT ExtendedInfo ( StepData ) >

<!ATTLIST ExtendedInfo StepType CDATA #REQUIRED>
<!ELEMENT DT (NodeArgs) >
<!ATTLIST DT rID ID #REQUIRED>

<!ELEMENT Summary (Param*)>
<!ATTLIST Summary sTime CDATA #IMPLIED eTime CDATA #IMPLIED passed CDATA #IMPLIED failed CDATA #IMPLIED warnings CDATA #IMPLIED retval CDATA #IMPLIED stopped (False|True) "False" >

<!ELEMENT Param (ParamName,ParamVal)+ >
<!ATTLIST Param paramInOut (In|Out) "In">

<!ELEMENT ParamName ( #PCDATA ) >

<!ELEMENT ParamVal ( #PCDATA ) >

]
>
<Report ver="2.0" tmZone="India Standard Time">
<General productName="QuickTest Professional" productVer="11.00" os="Windows 7" host="PC176102"><DocLocation><![CDATA[D:\karthi\TetrisProject\TetrisProject\Slingshot\src\bg\framework\app\functional\util\qtpScripts\SubmitMeterRead]]></DocLocation></General>
<Doc rID="T1"   productName= "QuickTest Professional"  >
<DName><![CDATA[SubmitMeterRead]]></DName>
<Res><![CDATA[Res18]]></Res>
<DT rID="T2">
<NodeArgs eType="Table" icon="2" nRep="4" filter="False" >
<Disp><![CDATA[Run-Time Data Table]]></Disp>
<BtmPane vType="Table">
<Path><![CDATA[Default.xls]]></Path>
</BtmPane>
</NodeArgs>
</DT>
<DIter rID="T3" iterID="1" >
<Action rID="T4">
<AName><![CDATA[Action1]]></AName>
<Step rID="T5">
<Obj plainTxt="False" ><![CDATA[Session]]></Obj>
<Details plainTxt="False" ><![CDATA[SAPGuiSession]]></Details>
<Time><![CDATA[11/15/2013 - 10:20:01]]></Time>
<TimeTick>1384491001</TimeTick>
<Step rID="T6">
<Obj plainTxt="False" ><![CDATA[wndSAPEasyAccess]]></Obj>
<Details plainTxt="False" ><![CDATA[SAPGuiWindow]]></Details>
<Time><![CDATA[11/15/2013 - 10:20:01]]></Time>
<TimeTick>1384491001</TimeTick>
<Step rID="T7">
<Obj plainTxt="False" ><![CDATA[wndSAPEasyAccess.Exist]]></Obj>
<Details plainTxt="False" ><![CDATA["Object exists"]]></Details>
<Time><![CDATA[11/15/2013 - 10:20:01]]></Time>
<TimeTick>1384491001</TimeTick>
<NodeArgs eType="Replay" icon="6" nRep="10" Source="Action1" SourceLine="-1" >
<Disp><![CDATA[wndSAPEasyAccess.Exist]]></Disp>
</NodeArgs>
</Step>
<Step rID="T8">
<Obj plainTxt="False" ><![CDATA["OKCode":Set "/n ECENV_BP"]]></Obj>
<Details plainTxt="False" ><![CDATA[Set "/n ECENV_BP"]]></Details>
<Time><![CDATA[11/15/2013 - 10:20:01]]></Time>
<TimeTick>1384491001</TimeTick>
<NodeArgs eType="Replay" icon="7" nRep="12" Source="Action1" SourceLine="-1" >
<Disp><![CDATA["OKCode":Set "/n ECENV_BP"]]></Disp>
</NodeArgs>
</Step>
<Step rID="T9">
<Obj plainTxt="False" ><![CDATA[SendKey ENTER]]></Obj>
<Details plainTxt="False" ><![CDATA[SendKey ENTER]]></Details>
<Time><![CDATA[11/15/2013 - 10:20:01]]></Time>
<TimeTick>1384491001</TimeTick>
<NodeArgs eType="Replay" icon="6" nRep="14" Source="Action1" SourceLine="-1" >
<Disp><![CDATA[SendKey ENTER]]></Disp>
</NodeArgs>
</Step>
<NodeArgs eType="Context" icon="6" nRep="9" Source="Action1" SourceLine="-1" >
<Disp><![CDATA[wndSAPEasyAccess]]></Disp>
</NodeArgs>
</Step>
<Step rID="T10">
<Obj plainTxt="False" ><![CDATA[wndDataEnvironmentBusiness]]></Obj>
<Details plainTxt="False" ><![CDATA[SAPGuiWindow]]></Details>
<Time><![CDATA[11/15/2013 - 10:20:03]]></Time>
<TimeTick>1384491003</TimeTick>
<Step rID="T11">
<Obj plainTxt="False" ><![CDATA[wndDataEnvironmentBusiness.Exist]]></Obj>
<Details plainTxt="False" ><![CDATA["Object exists"]]></Details>
<Time><![CDATA[11/15/2013 - 10:20:03]]></Time>
<TimeTick>1384491003</TimeTick>
<NodeArgs eType="Replay" icon="6" nRep="16" Source="Action1" SourceLine="-1" >
<Disp><![CDATA[wndDataEnvironmentBusiness.Exist]]></Disp>
</NodeArgs>
</Step>
<Step rID="T12">
<Obj plainTxt="False" ><![CDATA[edtBusiness Partner.Exist]]></Obj>
<Details plainTxt="False" ><![CDATA["Object exists"]]></Details>
<Time><![CDATA[11/15/2013 - 10:20:05]]></Time>
<TimeTick>1384491005</TimeTick>
<NodeArgs eType="Replay" icon="8" nRep="17" Source="Action1" SourceLine="-1" >
<Disp><![CDATA[edtBusiness Partner.Exist]]></Disp>
</NodeArgs>
</Step>
<Step rID="T13">
<Obj plainTxt="False" ><![CDATA["edtBusiness Partner":Set "2001578368"]]></Obj>
<Details plainTxt="False" ><![CDATA[Set "2001578368"]]></Details>
<Time><![CDATA[11/15/2013 - 10:20:05]]></Time>
<TimeTick>1384491005</TimeTick>
<NodeArgs eType="Replay" icon="8" nRep="19" Source="Action1" SourceLine="-1" >
<Disp><![CDATA["edtBusiness Partner":Set "2001578368"]]></Disp>
</NodeArgs>
</Step>
<Step rID="T14">
<Obj plainTxt="False" ><![CDATA[SendKey ENTER]]></Obj>
<Details plainTxt="False" ><![CDATA[SendKey ENTER]]></Details>
<Time><![CDATA[11/15/2013 - 10:20:05]]></Time>
<TimeTick>1384491005</TimeTick>
<NodeArgs eType="Replay" icon="6" nRep="21" Source="Action1" SourceLine="-1" >
<Disp><![CDATA[SendKey ENTER]]></Disp>
</NodeArgs>
</Step>
<NodeArgs eType="Context" icon="6" nRep="15" Source="Action1" SourceLine="-1" >
<Disp><![CDATA[wndDataEnvironmentBusiness]]></Disp>
</NodeArgs>
</Step>
<Step rID="T15">
<Obj plainTxt="False" ><![CDATA[wndDataEnvironment]]></Obj>
<Details plainTxt="False" ><![CDATA[SAPGuiWindow]]></Details>
<Time><![CDATA[11/15/2013 - 10:20:06]]></Time>
<TimeTick>1384491006</TimeTick>
<Step rID="T16">
<Obj plainTxt="False" ><![CDATA[wndDataEnvironment.Exist]]></Obj>
<Details plainTxt="False" ><![CDATA["Object exists"]]></Details>
<Time><![CDATA[11/15/2013 - 10:20:06]]></Time>
<TimeTick>1384491006</TimeTick>
<NodeArgs eType="Replay" icon="6" nRep="23" Source="Action1" SourceLine="-1" >
<Disp><![CDATA[wndDataEnvironment.Exist]]></Disp>
</NodeArgs>
</Step>
<NodeArgs eType="Context" icon="6" nRep="22" Source="Action1" SourceLine="-1" >
<Disp><![CDATA[wndDataEnvironment]]></Disp>
</NodeArgs>
</Step>
<Step rID="T17">
<Obj plainTxt="False" ><![CDATA[wndDataEnvironment_2]]></Obj>
<Details plainTxt="False" ><![CDATA[SAPGuiWindow]]></Details>
<Time><![CDATA[11/15/2013 - 10:20:06]]></Time>
<TimeTick>1384491006</TimeTick>
<Step rID="T18">
<Obj plainTxt="False" ><![CDATA["Collapse subtree   (Ctrl+Shift":Click]]></Obj>
<Details plainTxt="False" ><![CDATA[Click]]></Details>
<Time><![CDATA[11/15/2013 - 10:20:06]]></Time>
<TimeTick>1384491006</TimeTick>
<NodeArgs eType="Replay" icon="9" nRep="26" Source="Action1" SourceLine="-1" >
<Disp><![CDATA["Collapse subtree   (Ctrl+Shift":Click]]></Disp>
</NodeArgs>
</Step>
<Step rID="T19">
<Obj plainTxt="False" ><![CDATA[Stop Run]]></Obj>
<Details plainTxt="False" ><![CDATA[Run stopped by user.]]></Details>
<Time><![CDATA[11/15/2013 - 10:20:07]]></Time>
<TimeTick>1384491007</TimeTick>
<NodeArgs eType="General" icon="10" nRep="27" >
<Disp><![CDATA[Stop Run]]></Disp>
</NodeArgs>
</Step>
<NodeArgs eType="Context" icon="6" nRep="25" Source="Action1" SourceLine="-1" >
<Disp><![CDATA[wndDataEnvironment_2]]></Disp>
</NodeArgs>
</Step>
<NodeArgs eType="Context" icon="5" nRep="8" Source="Action1" SourceLine="-1" >
<Disp><![CDATA[Session]]></Disp>
</NodeArgs>
</Step>
<Summary sTime="11/15/2013 - 10:19:58" eTime="11/15/2013 - 10:20:07" passed="0" failed="0" warnings="0" ></Summary>
<NodeArgs eType="StartAction" icon="4" nRep="7" >
<Disp><![CDATA[Action1 Summary]]></Disp>
</NodeArgs>
</Action>
<NodeArgs eType="StartIteration" icon="3" nRep="6" >
<Disp><![CDATA[SubmitMeterRead Iteration 1 (Row 1)]]></Disp>
</NodeArgs>
</DIter>
<Step rID="T20">
<Obj plainTxt="False" ><![CDATA[Stop Run]]></Obj>
<Details plainTxt="False" ><![CDATA[Run stopped by user.]]></Details>
<Time><![CDATA[11/15/2013 - 10:20:07]]></Time>
<TimeTick>1384491007</TimeTick>
<NodeArgs eType="General" icon="11" nRep="30" >
<Disp><![CDATA[Stop Run]]></Disp>
</NodeArgs>
</Step>
<Summary sTime="11/15/2013 - 10:19:41" eTime="11/15/2013 - 10:20:07" passed="0" failed="0" warnings="0" stopped="True" ><Param ><ParamName><![CDATA[BpOrgNumber]]></ParamName><ParamVal><![CDATA[]]></ParamVal>
</Param>
<Param ><ParamName><![CDATA[Accountnumber]]></ParamName><ParamVal><![CDATA[]]></ParamVal>
</Param>
</Summary>
<NodeArgs eType="StartTest" icon="1" nRep="3" >
<Disp><![CDATA[Test SubmitMeterRead Summary]]></Disp>
</NodeArgs>
</Doc>
</Report>